{
  "round_id": "civiqs-profile-2026-w41",
  "entrant": "persistence",
  "profile": {
    "civiqs_net_approval_dem": {
      "mean": -96.4,
      "sd": 1.5
    },
    "civiqs_net_approval_ind": {
      "mean": -35.6,
      "sd": 1.5
    },
    "civiqs_net_approval_rep": {
      "mean": 65.8,
      "sd": 1.5
    },
    "civiqs_net_approval_age_18_34": {
      "mean": -51.3,
      "sd": 1.5
    },
    "civiqs_net_approval_age_35_49": {
      "mean": -36.2,
      "sd": 1.5
    },
    "civiqs_net_approval_age_50_64": {
      "mean": -8.6,
      "sd": 1.5
    },
    "civiqs_net_approval_age_65_up": {
      "mean": -7.4,
      "sd": 1.5
    },
    "civiqs_net_approval_race_white": {
      "mean": -10.4,
      "sd": 1.5
    },
    "civiqs_net_approval_race_black": {
      "mean": -83.8,
      "sd": 1.5
    },
    "civiqs_net_approval_race_hispanic": {
      "mean": -42.3,
      "sd": 1.5
    },
    "civiqs_net_approval_race_other": {
      "mean": -40.7,
      "sd": 1.5
    },
    "civiqs_net_approval_edu_noncollege": {
      "mean": -18.7,
      "sd": 1.5
    },
    "civiqs_net_approval_edu_college": {
      "mean": -29.4,
      "sd": 1.5
    },
    "civiqs_net_approval_edu_postgrad": {
      "mean": -48.6,
      "sd": 1.5
    },
    "civiqs_net_approval_male": {
      "mean": -14.1,
      "sd": 1.5
    },
    "civiqs_net_approval_female": {
      "mean": -35.3,
      "sd": 1.5
    }
  },
  "notes": "filed=2026-10-02T05:33Z, auto-filed baseline (persistence), frozen at participant deadline"
}
