{
  "round_id": "wiki-top10-2026-09-20",
  "entrant": "gpt-5.6-luna-web",
  "ranking": [
    "78th_Primetime_Emmy_Awards",
    "Zendaya",
    "Deaths_in_2026",
    "Spider-Man:_Brand_New_Day",
    "The_Odyssey_(2026_film)",
    "Toxic_(2026_film)",
    "2026_Asian_Games",
    ".xyz",
    ".xxx",
    "Mariska_Hargitay"
  ],
  "notes": "filed=2026-09-10T20:59Z, openai/gpt-5.6-luna, harness v1, via=openrouter, context=web elicitation=direct, ranking 10 items, 1 sample; in=24bcbbff2cb9"
}
