{
  "entrant": "gemini-pro-web-superfc",
  "notes": "filed=2026-10-08T23:26Z, gemini-3.1-pro-preview, harness v1, via=ppapi, effort=default, context=web elicitation=superfc, ranking 10 items, 1 sample; in=ac45ea4900c6",
  "ranking": [
    "Deaths_in_2026",
    ".xxx",
    "Christopher_Columbus",
    "Christa_Pike",
    "Ted_Kaczynski",
    "Lizzie_Borden",
    "Donald_Trump",
    "Kamala_Harris",
    "Halloween",
    "Digger_(2026_film)"
  ],
  "round_id": "wiki-top10-2026-10-18"
}
