{
  "round_id": "civiqs-profile-2026-w38",
  "entrant": "claude-sonnet-web-superfc",
  "profile": {
    "civiqs_net_approval_dem": {
      "mean": -96.1,
      "sd": 0.5
    },
    "civiqs_net_approval_ind": {
      "mean": -37.5,
      "sd": 2.2
    },
    "civiqs_net_approval_rep": {
      "mean": 65.5,
      "sd": 1.5
    },
    "civiqs_net_approval_age_18_34": {
      "mean": -51.0,
      "sd": 2.2
    },
    "civiqs_net_approval_age_35_49": {
      "mean": -35.3,
      "sd": 1.4
    },
    "civiqs_net_approval_age_50_64": {
      "mean": -8.3,
      "sd": 1.3
    },
    "civiqs_net_approval_age_65_up": {
      "mean": -10.0,
      "sd": 3.2
    },
    "civiqs_net_approval_race_white": {
      "mean": -12.0,
      "sd": 1.4
    },
    "civiqs_net_approval_race_black": {
      "mean": -82.0,
      "sd": 0.7
    },
    "civiqs_net_approval_race_hispanic": {
      "mean": -39.7,
      "sd": 1.8
    },
    "civiqs_net_approval_race_other": {
      "mean": -40.6,
      "sd": 1.4
    },
    "civiqs_net_approval_edu_noncollege": {
      "mean": -19.6,
      "sd": 2.0
    },
    "civiqs_net_approval_edu_college": {
      "mean": -31.0,
      "sd": 1.1
    },
    "civiqs_net_approval_edu_postgrad": {
      "mean": -48.6,
      "sd": 1.5
    },
    "civiqs_net_approval_male": {
      "mean": -14.7,
      "sd": 1.4
    },
    "civiqs_net_approval_female": {
      "mean": -36.6,
      "sd": 1.3
    }
  },
  "notes": "filed=2026-09-16T11:29Z, anthropic/claude-sonnet-5, harness v1, via=openrouter, context=web elicitation=superfc, profile 16 cells, 1 sample; in=bd4ae42c7fe1"
}
