{
  "entrant": "gemini-pro-web-superfc",
  "notes": "filed=2026-10-29T22:45Z, gemini-3.1-pro-preview, harness v1, via=ppapi, effort=default, context=web elicitation=superfc, profile 5 cells, 1 sample; in=39a013836df7",
  "profile": {
    "trends_share_disney": {
      "mean": 18.7,
      "sd": 1.5
    },
    "trends_share_iphone": {
      "mean": 43.5,
      "sd": 3.5
    },
    "trends_share_netflix": {
      "mean": 17.9,
      "sd": 1.5
    },
    "trends_share_samsung": {
      "mean": 10.9,
      "sd": 1.0
    },
    "trends_share_tesla": {
      "mean": 9.0,
      "sd": 1.5
    }
  },
  "round_id": "trends-basket-2026-11-07"
}
